{
  "actor": "foreman-remediate",
  "created": "2026-10-14T02:43:42Z",
  "decision_id": "01M4W4PMPP2AB5BGPP09TFTSNB",
  "kind": "dispatch_cadence",
  "payload": {
    "attempt": 1,
    "cadence": "docs-sync-fix",
    "parent": "docs-sync",
    "remediation": true,
    "source_run": "DEMO-docs-sync"
  },
  "project": "paysvc",
  "requires_session": true,
  "schema_version": 1,
  "status": "pending"
}
